,created_at,hours,full_text
0,2021-02-06 20:22:38+00:00,20.377222222222223,"RT @RepEscobar: Our country has the moral obligation and responsibility to reunite every single family separated at the southern border.

T…"
1,2021-02-06 20:16:39+00:00,20.2775,"RT @RoKhanna: What happens when we guarantee $15/hour?

💰 31% of Black workers and 26% of Latinx workers get raises.
😷 A majority of essent…"
2,2021-02-06 20:07:35+00:00,20.12638888888889,(Source: https://t.co/3o5JEr6zpd)
3,2021-02-06 20:07:07+00:00,20.11861111111111,"Joe Cunningham pledged to never take corporate PAC money, and he never did. Mace said she’ll cash every check she gets. Yet another way this is a downgrade. https://t.co/DytsQXKXgU"
4,2021-02-06 20:03:06+00:00,20.051666666666666,"What’s even more gross is that Mace takes corporate PAC money.

She’s already funded by corporations. Now she’s choosing to swindle working people on top of it.

Peak scam artistry. Caps for cash 💰 https://t.co/CcVxgDF6id"
5,2021-02-06 19:34:53+00:00,19.58138888888889,"Joe Cunningham already proving to be leagues more decent + honest than Mace seems capable of.

The House was far better off w/ Cunningham. It’s sad to see Mace diminish the representation of her community by launching a reputation of craven dishonesty right off the bat."
6,2021-02-06 19:25:13+00:00,19.42027777777778,"Pretty horrible.

Well, it’s good to know what kind of person she is early. Also good to know that Mace is cut from the same Trump cloth of dishonesty and opportunism.

Sad to see a colleague intentionally hurt other women and survivors to make a buck. Thought she’d be better. https://t.co/CcVxgDF6id"
7,2021-02-06 19:06:54+00:00,19.115000000000002,RT @jaketapper: .@RepNancyMace fundraising off the false smear that @AOC misrepresented her experience during the insurrection. She didn’t.…
8,2021-02-06 19:03:37+00:00,19.060277777777777,"RT @RepMcGovern: One reason Washington can’t “come together” is because of people like her sending out emails like this.

She should apolog…"
9,2021-02-06 00:38:35+00:00,0.6430555555555555,"RT @JoeNeguse: Just to be clear, “targeting” stimulus checks means denying them to some working families who would otherwise receive them."
10,2021-02-06 00:07:28+00:00,0.12444444444444444,"Amazon workers have the right to form a union.

Anti-union tactics like these, especially from a trillion-dollar company trying to disrupt essential workers from organizing for better wages and dignified working conditions in a pandemic, are wrong. https://t.co/nTDqMUapYs"
11,2021-02-05 23:40:24+00:00,23.673333333333336,"RT @WorkingFamilies: Voters elected Democrats to deliver more relief, not less."
12,2021-02-05 23:29:53+00:00,23.498055555555556,We should preserve what was there and not peg it to outdated 2019 income. People need help!
13,2021-02-05 23:05:52+00:00,23.097777777777775,"If conservative Senate Dems institute a lower income threshold in the next round of checks, that could potentially mean the first round of checks under Trump help more people than the first round under Biden.

Do we want to do that? No? Then let’s stop playing &amp; just help people."
14,2021-02-05 23:00:29+00:00,23.008055555555554,"@iamjoshfitz 😂 call your member of Congress, they can help track it down"
15,2021-02-05 22:23:05+00:00,22.384722222222223,"All Dems need for the slam dunk is to do what people elected us to do: help as many people as possible.

It’s not hard. Let’s not screw it up with austerity nonsense that squeezes the working class yet never makes a peep when tax cuts for yachts and private jets are proposed."
16,2021-02-05 22:10:35+00:00,22.17638888888889,"It should be $2000 to begin w/ anyway. Brutally means-testing a $1400 round is going to hurt so many people. THAT is the risk we can’t afford.

Income thresholds already work in reverse &amp; lag behind reality. Conservative Dems can ask to tax $ back later if they’re so concerned."
17,2021-02-05 22:04:36+00:00,22.076666666666668,"We cannot cut off relief at $50k. It is shockingly out of touch to assert that $50k is “too wealthy” to receive relief.

Millions are on the brink of eviction. Give too little and they’re devastated. Give “too much” and a single mom might save for a rainy day. This isn’t hard. https://t.co/o14r3phJeH"
18,2021-02-05 21:01:37+00:00,21.026944444444442,"Imagine being a policymaker in Washington, having witnessed the massive economic, social, and health destruction over the last year, and think that the greatest policy risk we face is providing *too much* relief.

Sounds silly, right?

$1.9T should be a floor, not a ceiling."
19,2021-02-05 16:03:15+00:00,16.054166666666667,@AndrewYang @TweetBenMax @RitchieTorres Thanks @AndrewYang! Happy to chat about the plan details and the community effort that’s gone into this legislation. 🌃🌎
20,2021-02-05 15:32:50+00:00,15.547222222222222,"@TweetBenMax @AndrewYang @RitchieTorres I wrote the original Green New Deal for Public Housing, which was written carefully w/ NYCHA residents, advocates, &amp; building trades to create over 30k jobs in the city and revamp public housing. This isn’t that plan.

The original work is here: https://t.co/pzdTv8WMXk"
21,2021-02-05 14:53:45+00:00,14.895833333333332,"Or @CoriBush’s powerful account of barricading in with her staff and the collective decision they made that if white supremacists breached their office, they had already come too far in the Movement for Black Lives to go down without a fight: https://t.co/vBN5pzmu10"
22,2021-02-05 14:49:56+00:00,14.832222222222223,"Or @RashidaTlaib’s story of what her threats have looked like and how they’ve escalated from the moment she got to Washington, and how she feels responsible for the safety of her staff: https://t.co/yKmidpBKqH"
23,2021-02-05 14:48:14+00:00,14.80388888888889,"They don’t want you to hear stories like @RepDeanPhillips, who yesterday spoke to his gut instinct to blend the floor w/GOP lawmakers bc he knew the mob was coming for Dems, &amp; affirmed the stark reality that his colleagues of color didn’t have that luxury: https://t.co/zG6rb5Akg1"
24,2021-02-05 14:43:24+00:00,14.723333333333333,"The reason some GOP are trying to sow false doubt about accounts of the Capitol attack is bc they know how powerful the testimony really is.

Each story reveals more details + the need for accountability.

You can see mine here: https://t.co/J7aaTuweLx

&amp; others on CSPAN below ⬇️ https://t.co/5nX8q6R3Wa"
25,2021-02-05 14:05:27+00:00,14.090833333333334,"RT @CBSThisMorning: “Why @AOC and I are here is because one of the biggest problems as a nation, as a society, is the stigma that's put on…"
26,2021-02-05 02:20:17+00:00,2.3380555555555556,"RT @atrupar: ""They're not 'The Squad' They're Ilhan. They are Alexandria. And they're Rashida. They are people. They are our colleagues ...…"
27,2021-02-05 02:07:16+00:00,2.121111111111111,"Thank you everyone for your puppy content today! 🐶

Here’s Deco from his first time camping and turning into a dinosaur 🏕 https://t.co/IjhXTb3nMW"
28,2021-02-05 01:11:08+00:00,1.1855555555555555,RT @atima_omara: Wow....Rep Dean Phillips talking about how he realized his colleagues of color in Congress would not be able to blend in i…
29,2021-02-05 01:10:56+00:00,1.1822222222222223,"This was incredibly powerful and moving.

Thank you, @RepDeanPhillips. https://t.co/8gdyTXgpoN"
30,2021-02-04 22:53:27+00:00,22.890833333333333,RT @JakeSherman: Hoyer with a quite powerful floor speech. Walked around the floor w a picture @mtgreenee posted of herself holding w gun n…
31,2021-02-04 22:04:34+00:00,22.07611111111111,RT @CBSThisMorning: EXCLUSIVE: @RepAOC &amp; @RepJasonCrow will join @CBSThisMorning live on Friday to discuss dealing with trauma in the wake…
32,2021-02-04 22:00:16+00:00,22.004444444444445,"Not only did I never make this claim, but I would never, ever do this.

What Greene is doing pumping this lie to her insurrectionist base is making them feel justified in further violence.

The prospect of stripping her committees clearly isn’t quelling her. She must be expelled. https://t.co/8WvvCgsMQt"
33,2021-02-04 21:53:34+00:00,21.892777777777777,"@NancyMace “I’m not discounting your experience, I’m just fact checking statements you never made and insinuating you said them”

Great job Mace 👍🏽 Hope you’re proud of how quickly you are to throw other survivors under the bus for a moment of personal gain.

Enjoy your Fox News hits."
34,2021-02-04 21:45:25+00:00,21.756944444444443,"@SmallTownPundit It’ll be available on CSPAN, which archives footage online for later viewing. If you follow our official Congressional accounts (usually they have “rep” in front of them - mine is @RepAOC) I’m sure many clips will also be reposted."
35,2021-02-04 21:41:26+00:00,21.690555555555555,"As I said earlier this week, my story of the attack on our Capitol is not the only story,nor is it the central story.

It is just one of 100s of stories.

Tonight, we will start to hear more on the House floor.

I invite all colleagues who wish to share to join our special order. https://t.co/O4rVIA4R95"
36,2021-02-04 21:33:30+00:00,21.558333333333334,"RT @scottwongDC: Lawmakers will share their personal stories of the Jan. 6 attack on the House floor tonight. 

.@AOC will kick off the spe…"
37,2021-02-04 19:46:03+00:00,19.7675,Bronx residents - you can get a vaccine appointment at Yankee Stadium next week! ⤵️ https://t.co/kLt5xLYfUv
38,2021-02-04 18:02:54+00:00,18.048333333333336,"Last night House Republicans gave a standing ovation to their GOP colleague who then went on the floor today to equate journalistic media outlets with QAnon.

These are the beliefs and actions they work to protect. It’s also a predictable outcome of 0 accountability for the 6th. https://t.co/eZNEbDcOdn"
39,2021-02-04 17:39:41+00:00,17.661388888888887,RT @repblumenauer: NEWS: I just introduced new legislation with @AOC and @BernieSanders that directs the president to declare a national cl…
40,2021-02-04 16:48:18+00:00,16.805,"RT @AriRabinHavt: During the attack I was at the Rayburn Tunnel. Trying to find a hiding place, I moved to Canon. A swat team came running…"
41,2021-02-04 16:41:54+00:00,16.698333333333334,"How many food workers or custodial workers or Capitol Police officers, who ran for their lives in Longworth or feared for their families in the weeks after the attacks, now think their terror is less valid because of her statements?

Mace’s attacks are attacks on them, too."
42,2021-02-04 16:37:20+00:00,16.622222222222224,"This is where the true damage of what @NancyMace is doing comes in.

How many survivors are watching her? Who now, seeing her, won’t get care or will feel further shame or silence? Who won’t speak up bc they know there are voices in leadership ready to minimize their experiences?"
43,2021-02-04 16:32:42+00:00,16.545,All I can think of w/ folks like her dishonestly claiming that survivors are exaggerating are the stories of veterans and survivors in my community who deny themselves care they need &amp; deserve bc they internalize voices like hers saying what they went through “wasn’t bad enough”
44,2021-02-04 16:23:24+00:00,16.39,"Wild that @NancyMace is discrediting herself less than 1 mo in office w/ such dishonest attacks. She *went on record* saying she barricaded in fear.

@NancyMace who else’s experiences will you minimize?Capitol Police in Longworth? Custodial workers who cleaned up shards of glass? https://t.co/l1CT0jIXJF"
45,2021-02-04 15:49:13+00:00,15.820277777777777,RT @AnthonyAdragna: New: @repblumenauer; @AOC and @BernieSanders introduce a bill requiring the president declare a national emergency for…
46,2021-02-04 15:39:58+00:00,15.666111111111112,"This was what you were saying just a few weeks ago.

Now you’re contradicting your own account to attack me for Fox News clicks.

It’s honestly pretty sad to see you turn around like this and throw other people under the bus.

Thought you’d be better.
https://t.co/1WPlwUWlar"
47,2021-02-04 15:34:46+00:00,15.579444444444444,"This is a deeply cynical &amp; disgusting attack, @NancyMace.

As the Capitol complex was stormed and people were being killed, none of us knew in the moment what areas were compromised.

You previously told reporters yourself that you barricaded in your office, afraid you’d be hurt. https://t.co/4FyWsaXSDx https://t.co/7gW6yKO9gJ"
48,2021-02-04 15:33:37+00:00,15.56027777777778,"@NancyMace This is a deeply cynical &amp; disgusting attack, @NancyMace.

As the Capitol complex was stormed &amp; people were being killed, none of us knew in the moment what areas were compromised.

You previously told reporters yourself that you barricaded in your office, afraid you’d be hurt. https://t.co/n4yoBXAUal"
49,2021-02-04 00:20:11+00:00,0.33638888888888885,"RT @JamaalBowmanNY: Republicans booed sister @CoriBush when she denounced white supremacy.

They just cheered someone who said Parkland and…"
50,2021-02-04 00:17:20+00:00,0.28888888888888886,"Sen. @MarshaBlackburn, you were more than comfortable going on TV to disparage me as a House member, so your excuse here doesn’t add up.

If you don’t support these racist, antisemitic conspiracy theories coming from your GOP House colleagues, why won’t you denounce them? https://t.co/7QJixUYHuW"
51,2021-02-03 23:38:30+00:00,23.641666666666666,"The sad thing about disinformation is that once the truth comes out, the damage has already been done. People have already been misled, radicalized &amp; believe lies to a point where their hatred has brewed to violence.

That’s what led to the 6th, and it’s happening right now."
52,2021-02-03 23:07:07+00:00,23.11861111111111,"Honestly what message were Republicans trying to send by appointing to the Education and Labor Committee a woman who believes the Sandy Hook shooting was fake and mocks Parkland survivors?

Individuals don’t get final say in cmtes. GOP leadership *picked* that assignment for her."
53,2021-02-03 22:09:30+00:00,22.15833333333333,"This is all to say that survivors are watching. Loved ones are watching. They may share their story tomorrow, or in months or years. Or they may never.

Speaking vitriol towards other survivors hurts you &amp; your loved ones. Bc dismissers rob themselves of meaningful relationships."
54,2021-02-03 21:59:36+00:00,21.993333333333336,"To be honest, every step of the way there were affirmers - @RepKatiePorter offering safety, @AyannaPressley pressing the pause button to acknowledge trauma, the courage of @Biaggi4NY, @yuhline, @CatalinaCruzNY &amp; many others to tell their stories publicly helped me share mine."
55,2021-02-03 21:54:59+00:00,21.91638888888889,"I really wrestled w telling my story, &amp; had decided about a week ago that it probably wasn’t worth it.

Then I had dinner with Sen. @Biaggi4NY. I told her everything because I knew she was a survivor. She helped me see the importance of sharing my story of the Capitol and trauma."
56,2021-02-03 21:50:34+00:00,21.842777777777776,"You may not know that you know a survivor, but it’s highly likely that you do.

Survivors of trauma are close to you. They are people you love &amp; you may not know.

Many decide whether their story is safe with someone by how they respond to other survivors.

Don’t push them away."
57,2021-02-03 19:03:45+00:00,19.0625,"Y’all!

Today is @AyannaPressley’s birthday! One of the greatest to ever do it.

Brilliant leader. Fearless champion. Masterful legislator. Uplifter. Organizer. She is everything.

Please join me in wishing her a happy birthday! 💐 https://t.co/DAGnhN5SYw"
58,2021-02-03 18:45:43+00:00,18.761944444444445,"@JackPosobiec This isn’t a fact check at all. Your arrows aren’t accurate. They lie about where the mob stormed &amp; place them further away than it was.

You also fail to the convey *multiple* areas people were trying to storm. It wasn’t 1. You also failed to show tunnels. Poor job all around."
59,2021-02-03 18:01:50+00:00,18.030555555555555,"It is also very damning and revealing that the GOP is now digging both heels in a discrediting campaign.

It’s because they know they are implicated, so they’re pivoting to (again) the classic abuse playbook of “it’s not as bad as they say.”

It was that bad. It’s actually worse."
60,2021-02-03 17:58:46+00:00,17.979444444444443,"People were trying to rush and infiltrate our office buildings - that’s why we had to get evacuated in the first place.

The attempts of attackers &amp; publicly available communications show how they tried to gain access and share location info on finding members for physical harm."
61,2021-02-03 17:56:18+00:00,17.938333333333333,"This is the latest manipulative take on the right.

They are manipulating the fact that most people don’t know the layout the Capitol complex.

We were all on the Capitol complex - the attack wasn’t just on the dome.

The bombs Trump supporters planted surrounded our offices too. https://t.co/jI18e0XRrd"
62,2021-02-03 17:49:06+00:00,17.81833333333333,"To survivors of any trauma who worry about being believed, or that their situation wasn’t “bad” enough or “too” bad, or fear being branded or deemed “manipulative” for telling the truth: I see you.

Community is here for you. You are safe with me, &amp; with all of us. You are loved!"
63,2021-02-03 14:39:43+00:00,14.661944444444444,"Good morning everyone! 🌞

I’m teaching my once-a-term digital / social media session for members of Congress today.

Help me help them! What do you wish you saw more of digitally from your elected officials? Who’s doing a great job that you think others can learn from? Lmk ⬇️"
64,2021-02-02 23:49:02+00:00,23.81722222222222,@RavMABAY Thank you Rabbi 💜
65,2021-02-02 23:43:26+00:00,23.723888888888887,"Republicans demanding that accountability is “divisive” and that we must “move on” from the attack on our country without recourse are taking a page from the playbooks of abusers.

It’s sadly unsurprising. After 4 years of fealty to Trump, it seems many GOP have turned into him. https://t.co/McADMwnmCE"
66,2021-02-02 23:32:42+00:00,23.545,"Senator Ted Cruz deliberately and knowingly amplified specific lies fueling violent attackers. In doing so, he contributed to the carnage of Jan 6th. His actions since show that if given similar political opportunity, he would choose to do it again.

He must resign. Texans agree. https://t.co/Oqw0kHWggg"
67,2021-02-02 05:21:24+00:00,5.3566666666666665,"RT @MondaireJones: I shared @AOC’s concern about being locked in the same room as my Republican colleagues on January 6th.

They had incite…"
68,2021-02-02 04:56:18+00:00,4.9383333333333335,"RT @MikeSpangenberg: One of the many important points @AOC made on IG tonight was that without accountability, when given the opportunity,…"
69,2021-02-02 04:55:01+00:00,4.916944444444445,"RT @hannahgais: .@AOC now on Cruz et al.: ""We are not safe with people who hold positions of power who are willing to endanger the lives of…"
70,2021-02-02 04:50:26+00:00,4.8405555555555555,@IlhanMN 💜
71,2021-02-02 04:48:03+00:00,4.800833333333333,"RT @Sifill_LDF: Are you hearing @RepKatiePorter describe how  @aoc took shelter in Porter’s office on Jan. 6th on @TheLastWord? 
Porter: I’…"
72,2021-02-02 04:34:10+00:00,4.569444444444445,Thank you @katieporteroc for holding it down that day 💜 you’re a wonderful friend https://t.co/UvvZKDYwEr
73,2021-02-02 04:26:18+00:00,4.4383333333333335,"Thanks for making the space for me, and hope we can all make space for others to tell their stories in the weeks to come.

And to those who wish to paper over their misdeeds by rushing us to all “move on” - we can move on when the individuals responsible are held to account."
74,2021-02-02 04:22:47+00:00,4.379722222222222,"My story isn’t the only story, nor is it the central story of what happened on Jan 6th.

It is just one story of many of those whose lives were endangered at the Capitol by the lies, threats, and violence fanned by the cowardice of people who chose personal gain above democracy."
75,2021-02-02 00:03:24+00:00,0.05666666666666667,"RT @JamaalBowmanNY: Millions of Americans are behind on rent. Which means millions are at risk of eviction.

We need to act immediately to…"
76,2021-02-02 00:03:03+00:00,0.050833333333333335,@zacharybooth @kylegriffin1 Probably around 9
77,2021-01-31 03:27:14+00:00,3.4538888888888892,Imagine thinking that ‘healthcare is a human right’ vs white supremacist conspiracy theories are two views “just as extreme” as the other 🤡🤡🤡
78,2021-01-31 03:20:41+00:00,3.3447222222222224,"Congratulations Sen. @JabariBrisport! 🎊

From public school teacher to the New York State Senate, we are all so proud of your journey and dedication to bringing so many along with you in the spirit of building a New York for the many.

Let’s go! https://t.co/zY1iT3SBe2"
79,2021-01-30 17:09:37+00:00,17.160277777777775,"RT @RepJayapal: More than half of Americans support forgiving all student debt — and nearly 2/3 support some amount of forgiveness. 

It’s…"
80,2021-01-30 16:15:03+00:00,16.250833333333333,RT @WhiteHouse: Climate change is an intersectional issue. Watch National Climate Advisor @Gina_McCarthy explain why: https://t.co/ZJ3LR0CW…
81,2021-01-30 03:54:44+00:00,3.9122222222222223,"RT @DrEricDing: Funeral costs—FEMA will reimburse up to $2 billion for #COVID19 funerals, said @AOC, who pushed for the funding as part of…"
82,2021-01-30 02:49:07+00:00,2.8186111111111107,@CoriBush @GOPLeader We got your back 💜
83,2021-01-29 22:26:24+00:00,22.44,"RT @GerryConnolly: Let's get this straight, @RepChipRoy. 

@AOC is saying aloud what MANY of us are thinking. Members of your party incited…"
84,2021-01-29 18:14:03+00:00,18.234166666666667,"Moving offices is a huge and disruptive effort. Honestly it shouldn’t even be Rep. Bush that has to move and endure all this, it should be Greene - she is the one that posing a threat to others around her."
85,2021-01-29 18:09:36+00:00,18.16,".@GOPLeader has a responsibility to ensure his members do not harm others.

He is losing control of his caucus &amp; allowing these threats to go unchecked, while looking the other way as members like @CoriBush feel so unsafe that she must move offices just 3 weeks into her 1st term. https://t.co/MfkGgM4JWU"
86,2021-01-29 17:09:54+00:00,17.165,The fact that the Republican Party will not take decisive action against white supremacists &amp; knowingly endorsed candidates who believe Muslim Americans shouldn’t serve in Congress &amp; posted threatening images holding firearms next to Dem members of Congress is extremely alarming. https://t.co/gFkR6x97TI
87,2021-01-29 04:52:43+00:00,4.878611111111112,A reminder https://t.co/WykDsPUnCI
88,2021-01-29 04:27:25+00:00,4.456944444444445,Yup ⬇️ https://t.co/7U3Z3ESkbx
89,2021-01-29 02:17:37+00:00,2.293611111111111,And were back! https://t.co/u9zNReAauY
90,2021-01-29 02:05:15+00:00,2.0875000000000004,Sorry y’all we’re trying to fix the audio! Be back in a few
91,2021-01-29 01:47:14+00:00,1.787222222222222,And were live! https://t.co/u9zNReAauY
92,2021-01-29 01:13:00+00:00,1.2166666666666668,@alexisgoldstein also joining!
93,2021-01-28 23:24:36+00:00,23.41,@alexisgoldstein Awesome! We’ll see what we can set up in time
94,2021-01-28 23:00:13+00:00,23.003611111111113,"🚨 Twitch Update!

@chamath will be joining me along with TheStockGuy to offer some updates and insight. Might be more to come https://t.co/BWS7SLXJ53"
95,2021-01-28 19:56:06+00:00,19.935,"“We need healing + unity, but I will not take any responsibility for my actions, nor will I acknowledge the contributions my lies made to the violence or the harm that it caused, nor do I believe anyone should be held accountable. But if you’re mad at that you’re divisive.” - GOP"
96,2021-01-28 19:51:23+00:00,19.85638888888889,"Oh, there’s anger?

Now why would there be anger that Cruz amplified known lies about our election that fueled an insurrection that cost ppl’s lives?

What does he think the logical response to his lies should be? A hug?

Maybe there’s anger bc his actions deserve accountability. https://t.co/92O6tYxzB3"
97,2021-01-28 19:07:44+00:00,19.128888888888888,"I’ll be hopping on Twitch at 8:30pm tonight to discuss today’s developments with GameStop and retail trading. 👾 Might have a guest or two join - we’ll see.

See you there!"
98,2021-01-28 18:01:07+00:00,18.01861111111111,"You haven’t even apologized for the serious physical + mental harm you contributed to from Capitol Police &amp; custodial workers to your own fellow members of Congress.

In the meantime, you can get off my timeline &amp; stop clout-chasing. Thanks.

Happy to work with other GOP on this."
99,2021-01-28 17:54:27+00:00,17.9075,"While you conveniently talk about “moving on,” a second Capitol police officer lost their life yesterday in the still-raging aftermath of the attacks you had a role in.

This isn’t a joke. We need accountability, and that includes a new Senator from Texas.
https://t.co/IQ69aZIt3v"
100,2021-01-28 17:46:10+00:00,17.769444444444442,"I am happy to work with Republicans on this issue where there’s common ground, but you almost had me murdered 3 weeks ago so you can sit this one out.

Happy to work w/ almost any other GOP that aren’t trying to get me killed.

In the meantime if you want to help, you can resign. https://t.co/4mVREbaqqm"
101,2021-01-28 17:04:32+00:00,17.075555555555557,RT @RoKhanna: Yes @aoc. We need an investigation into RobinhoodApp’s decision and who influenced that. And this shows the need for a financ…
