,created_at,hours,full_text
2467,2020-03-06 02:33:55+00:00,2.5652777777777778,"5 essential accountability questions courtesy of @CJAOurPower:

1. Who tells the story?
2. Who makes the decisions?
3. Who benefits, &amp; how?
4. What else will this impact?
5. How will this build or shift power?

Asked w/ environmental justice in mind, yet important for ALL policy. https://t.co/JfG1tBGd5b"
2468,2020-03-05 18:00:57+00:00,18.015833333333333,"Today is a hard day for so many people who love and respect @ewarren and admire her campaign - and I include myself in that.

Elizabeth Warren is a progressive lion, a champion for working families, and her commitment to inclusivity is exemplary. Thank you for being a role model. https://t.co/E9iZzo4Dwt"
2469,2020-03-05 15:39:10+00:00,15.652777777777779,"Coronavirus tips!

In addition to washing your hands, make sure you are also wiping down:

- Doorknobs 🚪
- Light switches 💡
- Your cell phone 🤳🏼
- Arm rests 💺
- Car/bike handles 🚲🚗
- &amp; anything your hands touch regularly! 🤝 

A spray or cleaner works fine. 🧽
Be well!"
2470,2020-03-04 22:01:20+00:00,22.022222222222222,"If you believe in:

healthcare as a right,
a living wage,
that working class &amp; marginalized people deserve power,
that climate action should be on the scale of the crisis,
that racial justice is key in all this &amp; more,

Then we are on the same team.
Let’s accomplish it together."
2471,2020-03-04 21:16:28+00:00,21.274444444444445,"It is important to fight for the issues, advance your argument, and grow the cause.

To do so, the questions that organizers or anyone seeking to advance a cause or campaign should always ask themselves are: who else can we include, and how can we listen and include them?"
2472,2020-03-04 21:12:28+00:00,21.20777777777778,"Effective organizers are welcomers, natural educators, and positive in their interactions.

They make new people feel like theirs is a movement they want to be part of.

Effective organizers treat the internet as an organizing space (although not the *only* organizing space!)."
2473,2020-03-04 18:09:02+00:00,18.150555555555552,"Lastly, my heart is also full at the candidacy of @cristinafortx whose race is currently too close to call in the runoff for TX Senate.

These women come from backgrounds that typically make running for office inaccessible. They are holding their own &amp; building progressive power. https://t.co/LgbLQT7xpK"
2474,2020-03-04 18:00:42+00:00,18.011666666666667,"Also incredibly proud of Georgette Gomez, who cleared the way in #CA53 and is now on the ballot for November.

@SDGeorgette is a progressive history-maker who fought Trump’s wall right in San Diego, and would be the first Queer Latina in Congress. 🏳️‍🌈 https://t.co/AlkMZWT7JY"
2475,2020-03-04 17:52:43+00:00,17.878611111111113,"I am so incredibly proud of Jessica Cisneros.

At 26 years old, she ran for office for the first time to offer TX28 new leadership that fights for workers, gender rights,&amp; a climate agenda.

She stood up to Koch brother money &amp; incumbency, &amp; she came closer than anyone imagined. https://t.co/3NiBVMfDrf"
2476,2020-03-03 21:13:42+00:00,21.22833333333333,"One practice I’ve used in no-hand shake situations is to put my hand over my heart and smile/nod at whomever I am greeting. (Shout out to our local NY14 faith communities for teaching me this!)

What’s your favorite handshake greeting alternative? https://t.co/xY1rXBjFZ0"
2477,2020-03-03 20:17:48+00:00,20.296666666666667,"It’s great to see Republicans understand this crisis &amp; advocate for socialized medicine.

No one should be charged for getting tested for Coronavirus, &amp; no one should be charged for getting treated.

This applies to pandemics and it should apply to any condition or care you need. https://t.co/bpwvIj5sL0"
2478,2020-03-03 19:52:35+00:00,19.87638888888889,"I know the internet can be an ugly place - speaking as someone who deals with a LOT of vitriol - but if your opinion of a campaign is primarily shaped by the internet, try taking a 2nd look at the work and movement-building happening on the ground. It’s different &amp; special."
2479,2020-03-03 19:46:56+00:00,19.78222222222222,"I’m a Bernie supporter who builds with Warren supporters. It’s how we got a top-to-bottom progressive ballot sweep in NY14.

Throughout it all, Alessandra &amp; I do town halls &amp;collect signatures together to get each other on the ballot.

We’ve got each other’s back.💜#BuildTogether https://t.co/G0QZVbbcDR"
2480,2020-03-03 17:04:14+00:00,17.070555555555554,"On top of the presidential race, there’s a whole lot of Congressional seats up today too!

Hit the phones for @JCisnerosTX today 📲 ⬇️ https://t.co/G4VLQN7CCm"
2481,2020-03-03 16:54:35+00:00,16.90972222222222,"RT @BernieSanders: If you can vote, show up today for those who can't—

The disenfranchised, who deserve their rights restored. 

The undoc…"
2482,2020-03-03 03:49:51+00:00,3.830833333333333,"What do they call doing the same thing over and over again,&amp; expecting different results?

If we do not run a strong, progressive candidate that directly addresses the core crises Americans face, we take a major risk.

The time is now.
Vote @BernieSanders.
https://t.co/rzaKXx0Tk6"
2483,2020-03-03 02:01:46+00:00,2.0294444444444446,"There will always be people who make the case against transformative change.

But today our generation’s prospects are worse off than our parents’. Today people are dying bc they can’t afford insulin. Today the for-profit caging of people is normal.

I, for one, choose change."
2484,2020-03-03 01:51:31+00:00,1.8586111111111112,"And while folks on TV went on about how we don’t need substantive change in America because things “aren’t that bad,” I couldn’t help but feel lied to.

Mountains of student debt.
Friends working multiple jobs just to afford rent.
Not one person I worked with had insurance.
/3"
2485,2020-03-03 01:49:37+00:00,1.8269444444444445,"I understand disaffected voters because I once was one.

As a waitress, I’d watch pundits on TV talk about how we didn’t need to improve the ACA much when almost no one I knew could afford insurance. Or they’d talk about how great the economy was when everyone I knew struggled./2"
2486,2020-03-03 01:45:52+00:00,1.7644444444444445,"To defeat Trump, it is going to take progressive, mass-movement politics that expands the electorate and fights for working-class &amp; marginalized people.

Turning back the clock may sound appealing to some, but we must recognize how we got here in the first place."
2487,2020-03-03 01:03:13+00:00,1.053611111111111,South Texas: Vote for @JCisnerosTX tomorrow! 🗳 https://t.co/xWu4lZAHYG
2488,2020-03-03 01:02:38+00:00,1.043888888888889,"RT @nataliewsj: Rep. @AOC on @JCisnerosTX primary: ""If she's able to pull this off tomorrow, it will be profoundly energizing. I, for one,…"
2489,2020-03-02 17:28:26+00:00,17.473888888888887,This was one of the sweetest moments of the day! 🥰 https://t.co/sKnrB6ou5O
2490,2020-03-02 00:37:36+00:00,0.6266666666666667,"RT @JCisnerosTX: Hey San Antonio! @JulianCastro will be hosting a canvass for our campaign on Tuesday. Join us and sign-up below!

https://…"
2491,2020-03-02 00:07:04+00:00,0.11777777777777777,@RjBklyn @stpatsforall Abigail did a great job advocating for Hannah and sickle cell patients everywhere. She made our community so proud today! 💜
2492,2020-03-01 21:24:32+00:00,21.40888888888889,Happy @StPatsforAll! 🍀💚 https://t.co/J7m8fimtBe
2493,2020-03-01 04:52:29+00:00,4.874722222222223,How to wash your hands *effectively* ⬇️ https://t.co/OVdKwOMokH
2494,2020-03-01 04:47:19+00:00,4.788611111111111,"I know buying a mask might feel productive to some, but if you don’t wash your hands WELL, still touch your face, etc it’s not doing much for you.

Right now the people who need masks are healthcare providers and patients w/ health needs. Consult your Dr.

&amp; Wash your hands! 🧼"
2495,2020-03-01 04:36:12+00:00,4.603333333333333,"I noticed going home that some people were wearing face masks but touching their face, not using sanitizer stations before eating in public, etc.

Everyone:
Wash your hands.
Don’t touch your face.
Wipe down your cell phone.

All of these practices are higher priority than a mask! https://t.co/GxXG9V1usr"
2496,2020-03-01 01:33:18+00:00,1.555,"Tashi Delek &amp; Namaste!

Had a wonderful time in Jackson Heights today at @adhikaar’s Nari Diwas celebration. ♥️@RepGraceMeng also brought by @RepEscobar of TX

Here’s to another year of sisterhood and strong women shaping Queens and beyond - Happy Losar to our NY14 families! 🐭 https://t.co/7vN8KQAfL0"
2497,2020-02-29 17:41:35+00:00,17.693055555555556,RT @RepSeanMaloney: My husband &amp; I have been raising kids for 27 years. Our eldest came to us when he was almost 3. His mom OD’d &amp; his dad…
2498,2020-02-29 16:44:22+00:00,16.739444444444445,"There’s a long history in the US of abusing scripture to advance the causes of bigotry &amp; discrimination.

Slaveholders did it.
Segregationists did it.
White supremacists do it.
And it continues.

Yet if Christ repeated himself today, they’d likely denounce him as a radical, too. https://t.co/y19PBDw5co"
2499,2020-02-29 01:32:34+00:00,1.5427777777777776,@steven_aquino Thanks so much for this! Digital accessibility is important to me so I’m thankful to you for pointing this out. To clarify - are you seeing the CAPTCHA on our official (.gov) website or our campaign site (.com)?
2500,2020-02-28 22:47:40+00:00,22.794444444444448,"RT @DFAaction: Thank you @AOC for not backing down from the fight for a #GreenNewDeal.
https://t.co/VjiyZdMMAR"
2501,2020-02-28 18:57:34+00:00,18.959444444444443,RT @NBCNews: Rep. Ocasio-Cortez and Lin-Manuel Miranda star in new ad urging New Yorkers to participate in 2020 census to avoid another pop…
2502,2020-02-28 15:32:11+00:00,15.536388888888888,"Sincerely,
an Intel global finalist,
a fmr multi-year intern for Sen. Kennedy,
a cum laude dual major in Economics &amp; International Relations,
a fmr Educational Director for national organization,
Who to you is “just a bartender,”
And also your colleague.

https://t.co/9ktAgXFXDE"
2503,2020-02-28 15:10:35+00:00,15.176388888888889,"Sen. Cruz, while I understand you judge people’s intelligence by the lowest income they’ve had, I hold awards from MIT Lincoln Lab &amp;others for accomplishments in microbiology.

Secondly, I’m surprised you’re asking about chromosomes given that you don’t even believe in evolution. https://t.co/vOIwJhpl7q"
2504,2020-02-27 23:59:53+00:00,23.998055555555556,"RT @chrislhayes: So here's what appears to be chain of events:

The Trump administration repatriated infected Americans over the objections…"
2505,2020-02-27 22:54:27+00:00,22.9075,"Thank YOU @staceyabrams for remaining undeterred in the fight for our democracy, and for your continued work on the ground with @fairfightaction, @faircount &amp; beyond. https://t.co/q3uAPv0c1o"
2506,2020-02-27 22:43:31+00:00,22.725277777777777,"RT @nowthisnews: ‘The Georgia secretary of state reportedly purged more than half a million voters from the rolls, blocked thousands of new…"
2507,2020-02-27 21:17:26+00:00,21.290555555555557,"RT @jimwallis: “...if Christ Himself walked through these doors, [teaching] that we should love our neighbor and our enemy, that we should…"
2508,2020-02-27 19:47:54+00:00,19.798333333333336,"RT @Lin_Manuel: El #Censo2020 determina los fondos y la representación de NYC para la próxima década.

Ésta es nuestra oportunidad para con…"
2509,2020-02-27 19:41:21+00:00,19.689166666666665,"The Census comes once every 10 years. From school💰to representation, it shapes many aspects of our lives.

*Everyone* counts in the Census, no matter who you are or where you’re from. You will NOT be asked about immigration status.

The more you know! 💫 https://t.co/HVihizEh7L"
2510,2020-02-27 18:25:26+00:00,18.42388888888889,RT @ProudResister: .@AOC just turned the whole “religious freedom” argument on its head saying the only time it is invoked is in the name o…
2511,2020-02-27 17:55:31+00:00,17.92527777777778,RT @GuthrieGF: “It is part of my faith that all people are holy and all people are sacred. Unconditionally.” @AOC just delivered a sermon t…
2512,2020-02-27 16:27:35+00:00,16.459722222222222,"RT @JCisnerosTX: You hear a lot about our community on TV.

You hear about us, but you never really hear from us.

We‘re the border.

And w…"
2513,2020-02-27 15:12:55+00:00,15.215277777777777,"RT @chrislhayes: Good lord. Given the fact the entire Morales government was toppled over accusations of election fraud, the OAS has *a lot…"
2514,2020-02-27 01:33:27+00:00,1.5575,"As governor, Pence’s science denial contributed to one of the worst HIV outbreaks in Indiana’s history.

He is not a medical doctor. He is not a health expert. He is not qualified nor positioned in any way to protect our public health.
 
https://t.co/1jVY44p2HF"
2515,2020-02-27 01:27:09+00:00,1.4525,"Mike Pence literally does not believe in science.

It is utterly irresponsible to put him in charge of US coronavirus response as the world sits on the cusp of a pandemic.

This decision could cost people their lives. Pence’s past decisions already have. https://t.co/NhMPOusOWm"
2516,2020-02-26 21:02:32+00:00,21.042222222222225,"RT @mmcauliff: .@AOC asks on House floor why so many find the Green New Deal so controversial. ""Because for years we have prioritized the p…"
2517,2020-02-26 19:30:24+00:00,19.506666666666668,"RT @Public_Citizen: .@AOC: The Georgia Secretary of State reportedly purged more than half a million voters from the rolls, blocked thousan…"
2518,2020-02-26 18:24:27+00:00,18.4075,"Fue un honor conocerte, @YalitzaAparicio. Eres una inspiración por mujeres y trabajadores en el mundo.

Gracias por la conversación - juntos luchamos por los derechos de trabajadores del hogar. 💜🏠 https://t.co/rhv2Y54ktP"
2519,2020-02-26 03:26:13+00:00,3.436944444444445,RT @dmedin11: There was also not one question on immigration.
2520,2020-02-26 03:17:20+00:00,3.2888888888888888,Not a single climate change question. Horrifying.
2521,2020-02-26 02:51:54+00:00,2.865,Errol moderates NYC debates. He knows a thing or two about how to wrangle energetic candidates! 😉⬇️ https://t.co/3EbqNbTFtU
2522,2020-02-26 01:25:10+00:00,1.4194444444444445,"1. 
https://t.co/W4wxP5Dyem

2. 
https://t.co/SqmgCxzBdY"
2523,2020-02-26 01:23:53+00:00,1.3980555555555556,"Bloomberg did not “cut back” stop and frisk. He continues to lie about this, and it’s disturbing.

A judge ruled stop and frisk unconstitutional. Bloomberg fought for *years* defending the policy, and only reversed course when he decided to run for president."
2524,2020-02-25 22:53:35+00:00,22.893055555555556,"I used to work in the food industry.

I can’t tell you how many times the people who handle your food - who are already overworked &amp; underpaid - show up sick to work because our country refuses to guarantee healthcare or paid sick leave.

We need #MedicareForAll."
2525,2020-02-25 19:14:50+00:00,19.247222222222224,RT @brianschatz: The Coronavirus is not contained. It will not fade in the spring. Trump cut CDC by 9 percent. Trump eliminated the positio…
2526,2020-02-25 19:08:33+00:00,19.1425,"Don’t be that person who talks a big game on the internet but can’t keep that same energy in person 😂

Just be yourself! https://t.co/YhzYsr6rDF"
2527,2020-02-25 16:49:27+00:00,16.824166666666667,Had an great time with @breakfastclubam - you can catch this morning’s interview here: https://t.co/H2xLw2NtpU https://t.co/sTJM8ViCVz
2528,2020-02-24 17:39:42+00:00,17.661666666666665,"American Hero.

Thank you, Katherine Johnson. 🇺🇸 https://t.co/TzbEP8HUuY"
2529,2020-02-24 17:31:21+00:00,17.522499999999997,RT @soledadobrien: Wife of Supreme Court Justice.
2530,2020-02-24 17:27:55+00:00,17.46527777777778,"RT @mattdpearce: The coronavirus story will also become a health-insurance story in America. This guy went to China, caught the flu, came b…"
2531,2020-02-23 18:33:28+00:00,18.55777777777778,"I hope folks listen to what Anand is saying here.

Mass movements are beginning to transform our political landscape in a way we haven’t seen in a long time.

This kind of politics is an important shift away from saviorism. It’s not about “the one” - it’s about the many. #NotMeUs https://t.co/sgOCXHz91L"
2532,2020-02-23 17:41:39+00:00,17.694166666666668,"RT @NY1: Congresswoman @AOC, who represents parts of Queens and the Bronx, teamed up with city census officials for a town hall Saturday in…"
2533,2020-02-23 03:01:29+00:00,3.024722222222222,"This isn’t about swing seats or pushing communities “too far left.”

It’s about accountability. Working families deserve so much better. And if we aren’t willing to admit where we can do better, then what is the point?

Our job is to serve the people, not the powerful."
2534,2020-02-23 02:58:04+00:00,2.967777777777778,"For those upset about critique of establishment politics:

There are D reps in SAFE blue seats who side w/ the NRA, are anti-LGBT+, and yet are protected because they advance the interests of big donors, Wall St, fossil fuels, etc.

It’s not “wrong” to take that on and do better. https://t.co/0Frl0vPlap"
2535,2020-02-23 02:02:12+00:00,2.0366666666666666,"Solo hay un camino: juntos. 

Gracias, Nevada. https://t.co/chm5BBQrL2"
2536,2020-02-23 00:42:01+00:00,0.7002777777777778,"After our town hall on the Census in Corona, some of us grabbed a bite to eat at Boca Chica and someone in the community called in a serenata  🎶💕

Our community has so much beauty and talent bursting from every corner. Listen to their amazing voices! 😭 https://t.co/1QN3UvZFRo"
2537,2020-02-22 23:18:21+00:00,23.305833333333332,"Mind you this is also important because immigration and progressive ag issues are where many Dems get scared.

Bernie doesn’t. His immigration plan is next level - read it. And next time, ask yourself why Latinx communities are so often treated as disposable in Washington."
2538,2020-02-22 23:15:43+00:00,23.261944444444445,"Over &amp; over again, I hear insider consultants say that investing in Latinx outreach is a “waste of time.”

When I ran, people TOLD me “not to bother” with my own community.

Bernie takes Latinx outreach seriously. He was often the only 1 showing up to Iowa satellite caucuses,too. https://t.co/BkpnR8evbS"
2539,2020-02-22 22:44:12+00:00,22.736666666666668,RT @traceyecorder: The Democratic establishment most certainly DID NOT give us civil rights or voting rights - those things were fought for…
2540,2020-02-22 22:25:01+00:00,22.416944444444447,"Do you know who’s one of the most undercounted communities during the Census?

Children under 5!

Double check that you’ve included newborns and small children in your home when your Census form comes in starting March 12 🗒

👨‍👩‍👧👨‍👨‍👦‍👦👩‍👩‍👧‍👧👩‍👦‍👦👨‍👦 https://t.co/XcLE7hRtBf"
2541,2020-02-22 19:02:02+00:00,19.03388888888889,@soledadobrien Thanks! ☺️💕
2542,2020-02-22 19:00:02+00:00,19.000555555555554,Tempted to do a “woman on the street” bit and wait outside the Republican cloak room to ask each GOP Congressman how much their tailored suits cost 🎤
2543,2020-02-22 18:47:44+00:00,18.795555555555556,"RT @CharlotteAlter: As I explore in my book, the sexist obsession with @AOC's clothing is part of a broader campaign to discredit her polit…"
2544,2020-02-22 18:12:00+00:00,18.2,"Yep! I rent, borrow, and thrift my clothes. (It’s also environmentally sustainable!) 🌎

The Post is just mad that you can look good fighting for working families.

Sequins are a great accessory to universal healthcare, don’t you agree? ✨😉 https://t.co/xdQ65lbpXe"
2545,2020-02-22 04:36:51+00:00,4.614166666666667,"RT @KamalaHarris: Russia interfered in the election of the president of the United States once—and they’re at it again.

Election security…"
2546,2020-02-21 21:24:30+00:00,21.40833333333333,@karaswisher Congratulations! 🎊
2547,2020-02-21 16:18:33+00:00,16.309166666666666,RT @_waleedshahid: This project from @AOC is such an important use of her platform to build a critical part of campaign infrastructure for…
2548,2020-02-21 15:22:47+00:00,15.379722222222222,"It’s time to elect a progressive majority in Congress accountable to strong, grassroots movements that push support for issues like Medicare for All, a Green New Deal, racial justice, &amp; more.

It’s time to elect public servants with the Courage to Change: https://t.co/K6JXmCH2Vh"
2549,2020-02-21 15:17:50+00:00,15.297222222222222,"Today @CouragetoChange is announcing its first endorsements of newcomers to Congress:

SENATE
Cristina Tzintzún Ramirez (TX)

HOUSE
Teresa Fernandez (NM)
Kara Eastman (NE)
Georgette Gomez (CA)
Marie Newman (IL)
Jessica Cisneros (TX)
Samelys Lopez (NY)
https://t.co/sbSKTipijm"
2550,2020-02-21 03:57:04+00:00,3.9511111111111115,@tysantowney That would be unconstitutional! ☺️
2551,2020-02-21 03:37:11+00:00,3.6197222222222223,"@jeremycabo Not tomorrow, but working on it!"
2552,2020-02-21 03:36:40+00:00,3.611111111111111,@MichaelArtress I can’t believe I have to fight to get back into Silver again 🤦🏽‍♀️
2553,2020-02-21 03:32:07+00:00,3.5352777777777775,Big announcement coming tomorrow 😌
2554,2020-02-21 03:28:40+00:00,3.477777777777778,"RT @nytimes: Russia is aiding President Trump in the 2020 election, intelligence officials told lawmakers. Trump complained Democrats might…"
2555,2020-02-21 00:43:40+00:00,0.7277777777777777,"One major reason I support Bernie is his consistency when things are hard.

Not only does Bernie reject corporate money in 2020, he’s also never taken corporate lobbyist money in his *entire political career.*

He is a real one. And in politics, that is nearly impossible to find. https://t.co/GQba01HnEa"
2556,2020-02-20 19:33:40+00:00,19.561111111111114,RT @BernieSanders: Let's level. Medicare for All will save tens of thousands of lives and $450 billion every year. #DemDebate https://t.co/…
2557,2020-02-20 18:56:40+00:00,18.944444444444446,"(And I’m not necessarily asking as a critique, I’m genuinely curious. Doesn’t taking this position automatically invalidate whoever comes out on top if they don’t clear 50%?)"
2558,2020-02-20 17:52:46+00:00,17.879444444444445,"RT @elizaorlins: Roger Stone was just sentenced to 3 years and 4 months in prison. 

A man I represented is currently serving a sentence of…"
2559,2020-02-20 17:51:56+00:00,17.865555555555556,"Yeah, I’ve been sitting with this.

Genuinely asking, if your candidate - Biden, Buttigieg, Warren, Klobuchar etc - clearly had the most votes and the most delegates, why shouldn’t they be the nominee?

And what do folks envision as a fair and just alternative in doing otherwise? https://t.co/Tffc8R45uH"
2560,2020-02-20 17:11:35+00:00,17.193055555555556,"It’s truly time to retire the misogynist trope that angry men are powerful, yet angry women are unhinged.

It’s such gaslighting nonsense. You SHOULD be mad at abuse of power. The real question is how one channels that energy into positive change that creates justice."
2561,2020-02-20 17:07:53+00:00,17.13138888888889,"Warren was not mean, nor angry.

She was effective.

And by the way, we are allowed to be angry about racial profiling. You’re allowed to be angry about sexual harassment. Or at big banks committing fraud against single parents.

Anger at injustice is quite appropriate. https://t.co/LIUpF7L9Sm"
2562,2020-02-20 13:36:50+00:00,13.613888888888889,RT @NickKristof: We're tortured with bootstraps! The up-by-bootstraps narrative actually impairs upward mobility by substituting sanctimony…
2563,2020-02-20 13:15:21+00:00,13.255833333333333,"RT @JoyAnnReid: This is what was missed in last night's #DemDebate, as fiery as it was: we are in an increasingly authoritarian national em…"
2564,2020-02-20 05:11:20+00:00,5.188888888888889,@JStein_WaPo Your mentions are all downhill from here on out 🤕
2565,2020-02-20 04:52:59+00:00,4.883055555555556,"Yes, let’s talk about pensions - like how private equity groups load a ton of risk from unethical practices on the pensions of teachers, nurses, &amp; public servants - so that when a bubble pops, it’s working people that are left holding the bag.

https://t.co/RZuJ25qEya https://t.co/4GzuPZETcr"
2566,2020-02-20 04:43:02+00:00,4.717222222222222,"Ironically, the reason many tech platforms have created billionaires is bc they track you without your knowledge, amass your personal data&amp; sell it without your express consent.

You don’t own your data, &amp; you should. And btw, the internet was created w/ publicly funded research. https://t.co/dcCzZKmbzh"
2567,2020-02-20 04:17:54+00:00,4.298333333333333,RT @billmckibben: Thank you @AOC. This is one of the few vital lessons for everyone to understand--and the hardest for most politicians to…
2568,2020-02-20 04:11:02+00:00,4.183888888888889,"(&amp; if not this way, acquiring a billion dollars can also happen via monopoly power, low wages, rent-seeking behavior, not paying fair share of taxes, etc)"
2569,2020-02-20 03:59:41+00:00,3.9947222222222223,"We can work out the logistics, but we could absolutely use far more opportunities for candidates to shine based on substance."
