,created_at,hours,full_text
1591,2020-07-08 20:43:34+00:00,20.72611111111111,"The Climate Task Force has agreed to elevate Biden’s climate standards across the board &amp; adopt a whole-of-gov mobilization, incl:
- Ambitious construction, mass transit, &amp; transport, &amp; ag standards+investment
- Creating millions of good jobs
- Centering climate justice standards"
1592,2020-07-08 20:36:57+00:00,20.615833333333335,"Today the 6 Biden-Sanders Unity Task Forces are unveiling final language.

The Climate Task Force accomplished a great deal. It was an honor to serve as co-chair w/ Sec. @JohnKerry.

Among the notable gains: we shaved *15 years* off Biden’s previous target for 100% clean energy. https://t.co/pnLj7uufeg"
1593,2020-07-08 15:04:19+00:00,15.071944444444444,RT @EdMarkey: It is the honor of a lifetime to work alongside brilliant leaders and activists like @AOC and the @sunrisemvmt. The grassroot…
1594,2020-07-08 02:32:39+00:00,2.5441666666666665,"Yes @GOPLeader, @IlhanMN has long been on the side of dismantling systems of oppression &amp; structural racism, as she stated.

It‘s revealing that *YOU* equated “oppression” w/ “our entire system” as you intentionally took a Black Congresswoman’s words out of context to target her. https://t.co/8U00MDCZVP"
1595,2020-07-05 17:23:00+00:00,17.383333333333333,"Is it me, or is the GOP losing their touch with the conspiracy-theory-as-campaign-rhetoric technique?"
1596,2020-07-05 17:21:03+00:00,17.350833333333334,"Yes, that is precisely why the party nominated... Joe Biden https://t.co/ZFx5YAnd9b"
1597,2020-07-04 15:34:49+00:00,15.580277777777777,"I’m not on TikTok, but that won’t stop me from making bootleg ones for IG 😉 https://t.co/2VU9Dg5nH5"
1598,2020-07-02 20:54:00+00:00,20.9,"Vanessa Guillen’s family deserves justice.

What happened to her, and to so many victims of sexual harassment and assault in the military, is utterly unacceptable.

We need an independent investigation. Thank you @RepSylviaGarcia for leading the charge. https://t.co/ScubfNak9k"
1599,2020-07-02 19:40:52+00:00,19.68111111111111,@ZerlinaMaxwell Ahh! I’ll be mindful of that when the character count allows 😂
1600,2020-07-02 18:20:20+00:00,18.33888888888889,"Maxwell’s arrest is a significant development.

I hope the SDNY and all relevant parties have conducted an extensive review of the failures of Epstein’s custody to ensure Maxwell’s safety as this case bears out. https://t.co/5o5HqwJskO"
1601,2020-07-02 18:06:36+00:00,18.110000000000003,RT @JoaquinCastrotx: We need answers and justice for #VanessaGuillen. My heart continues to be with her family and survivors of sexual hara…
1602,2020-07-01 23:22:44+00:00,23.378888888888888,"RT @Eugene_Scott: Black voters, on average, wait 45 percent longer to vote than white voters; Latino voters wait 46 percent longer. https:/…"
1603,2020-07-01 22:18:43+00:00,22.311944444444446,"Guess who’s repeal of the Faircloth Amendment just passed the House! 😌 

Faircloth has blocked construction of new public housing in the United States for 20+ YEARS. Repeal is key to tackling our housing crisis.

THANK YOU to the advocates who‘ve worked so hard to get here. https://t.co/JkcJvNBr72"
1604,2020-07-01 21:44:52+00:00,21.747777777777777,The @EdMarkey meme team is really something else 😂 https://t.co/kzXkHE3bbF
1605,2020-07-01 21:37:04+00:00,21.61777777777778,"@iTeachGatsby Thank you so much, and thanks for being open to new perspectives. Grateful to have earned your support 💜"
1606,2020-07-01 21:30:50+00:00,21.51388888888889,@kendallybrown Please tell your mom I say thank you and she’s welcome to our team anytime! 💜☺️
1607,2020-07-01 17:35:35+00:00,17.593055555555555,"One of the ways the GOP articulates their racism today is their idea that some citizens are “real” people and others aren’t.

This is the argument they make against DC statehood: that this largely Black community doesn’t qualify as “real people.”

So, who is a “real” person? 🤔 https://t.co/QzyKjH6UGF"
1608,2020-07-01 17:13:03+00:00,17.217499999999998,https://t.co/yOxvgQxhnA https://t.co/6lqpXGW3RW
1609,2020-07-01 15:40:14+00:00,15.670555555555556,"How’s that “anti-AOC” advertising going, Oklahoma GOP?

Oh, it ended with voters supporting Medicaid expansion? Nice. 😊 https://t.co/Xkcw7PeiCJ"
1610,2020-07-01 15:32:19+00:00,15.538611111111111,"When you speak truth to power, power fights back.

Lobbyists &amp; conservatives have been pouring millions of dollars against our sisterhood’s re-election campaigns.

Why? Because we’re effective. Join the Squad Victory Fund to protect the fight for justice:
https://t.co/qcIJN79JPH"
1611,2020-07-01 00:31:15+00:00,0.5208333333333334,RT @hollyotterbein: Scoop: A dozen lawmakers have signed onto the hotly debated letter spearheaded by Alexandria Ocasio-Cortez that calls f…
1612,2020-06-30 23:27:37+00:00,23.460277777777776,"RT @SenSanders: Israel's annexation of occupied territory would be a disaster for international law, self-determination, freedom and equali…"
1613,2020-06-30 23:26:16+00:00,23.43777777777778,RT @HeerJeet: The New Deal gave us Carl Reiner.
1614,2020-06-27 22:44:12+00:00,22.736666666666668,"Hey all, note for transparency: yday I quote-tweeted someone noting that we pay interns a living wage.

It has since been brought to my attn that multiple survivors are speaking up about this individual. My heart breaks for them, and I am deleting the quote tweet in solidarity."
1615,2020-06-26 21:07:39+00:00,21.1275,@JamaalBowmanNY 💜
1616,2020-06-26 21:03:20+00:00,21.055555555555557,RT @ReuvenBlau: NEW: hours after @AOC called on @CorrectionNYC to fire officers involved in Layleen Polanco's death @NYCMayor announces tha…
1617,2020-06-26 18:36:34+00:00,18.609444444444446,"Two years ago today, I went from waitress and organizer to winning a Congressional primary while outspent 10-1.

Every day since I’ve tried to do right by working families &amp; the movement that made it happen. Corrupt interests haven’t had a good night’s sleep since😉

Thank you 💜 https://t.co/5Yv1jYDEB5"
1618,2020-06-26 13:59:34+00:00,13.992777777777777,RT @patriotact: How does justice play a role in the Green New Deal? @AOC explains. https://t.co/SDxCTwAZG9 https://t.co/4GG7GWk7T3
1619,2020-06-26 02:31:21+00:00,2.5225,"Our team has been working with artists to reimagine communities into modern day, WPA-style Green New Deal posters.

So far we’ve got the Bronx, Queens, Detroit, Boston, Los Angeles, &amp; San Juan 🇵🇷

You can find them at https://t.co/FChYMy3UrE https://t.co/92lM2W6PzN"
1620,2020-06-26 01:03:50+00:00,1.0638888888888889,RT @BLeeForCongress: Defund the Pentagon budget.
1621,2020-06-25 21:37:24+00:00,21.623333333333335,"RT @_waleedshahid: ""Can @JamaalBowmanNY be in The Squad?"" -@CharlotteAlter 

""Well, we have the same haircut. So I am certainly open."" -@Ay…"
1622,2020-06-25 14:24:54+00:00,14.415000000000001,"RT @theintercept: Sen. Bernie Sanders will propose a sweeping 10 percent cut to Pentagon spending, with the savings redirected as grant mon…"
1623,2020-06-25 02:21:17+00:00,2.354722222222222,@AyannaPressley Thanks sis - love you and always so grateful for your friendship 💞
1624,2020-06-24 19:03:44+00:00,19.06222222222222,"Thank you for paving the way, @BLeeForCongress! 👑 https://t.co/svZW1INJ5C"
1625,2020-06-24 16:46:08+00:00,16.76888888888889,"RT @JamaalBowmanNY: I’m a Black man raised by a single mother in a housing project. That story doesn’t usually end in Congress. 

But today…"
1626,2020-06-24 05:40:02+00:00,5.667222222222223,@BernieSanders Thanks tío! ☺️
1627,2020-06-24 03:35:39+00:00,3.5941666666666667,"Wall Street CEOs, from Goldman Sachs to Blackstone, poured in millions to defeat our grassroots campaign tonight.

But their money couldn’t buy a movement.

Thank you #NY14, and every person who pitched in for tonight’s victory.

Here’s to speaking truth to power. https://t.co/g9aRV3Cu1B"
1628,2020-06-24 03:01:08+00:00,3.0188888888888887,RT @sahilkapur: The AOC race is a blowout. https://t.co/qK780a1Iga
1629,2020-06-24 02:33:37+00:00,2.5602777777777774,"When I won in 2018, many dismissed our victory as a “fluke.”

Our win was treated as an aberration, or bc my opponent “didn’t try.”

So from the start, tonight’s race was important to me.

Tonight we are proving that the people’s movement in NY isn’t an accident. It‘s a mandate."
1630,2020-06-24 01:31:04+00:00,1.5177777777777777,"#TeamAOC volunteers made over 56,000 calls to NY14 TODAY. As in ONE DAY.

That’s shattered all our previous one-day records.

For everyone who has put in time to support, volunteer, or contribute - I cannot thank you enough."
1631,2020-06-24 00:45:22+00:00,0.7561111111111111,RT @IndivisibleTeam: This is what voter suppression looks like.
1632,2020-06-24 00:13:45+00:00,0.22916666666666669,"We are seeing reports of voting lines as long as 3 hours in LeFrak City as well. Other poll sites are much faster.

If you can, STAY IN LINE!

If you are *in line* at your polling location by 9pm, you CAN vote. https://t.co/qBx1PubRCm"
1633,2020-06-23 20:39:43+00:00,20.661944444444444,"I usually don’t tweet to correct fake posts about me bc the right circulates so many, but needless to say the alleged “deleted” reopening tweet people are saying I wrote is a photoshopped fake being circulated by Republicans.

They tell lies because the truth isn’t on their side. https://t.co/WQxMxCJofe"
1634,2020-06-23 16:05:19+00:00,16.08861111111111,"We are realizing that a better world is possible. It’s time to rise for it, speak on it, and create it every day.

Today, we vote for it.
https://t.co/boXm0U4sZ4"
1635,2020-06-23 13:54:23+00:00,13.90638888888889,"NY14: TODAY is Election Day!

🚨Voting tips:

- You should receieve 2 BALLOTS to fill out. If you only got one, ask for the other.

- It was confirmed last night that many NYers who requested absentees will not receive them. This is v upsetting - if you can, vote in person today. https://t.co/Qd51xbDDYr"
1636,2020-06-22 21:15:51+00:00,21.264166666666668,"Your membership card is in the mail, @hasanminhaj 😂📮 https://t.co/DwiwLBkQdX"
1637,2020-06-22 17:51:53+00:00,17.864722222222223,"RT @Phil_Lewis_: Protesters are out in Compton demanding justice for Andres Guardado, an 18-year-old who was fatally shot 7 times in the ba…"
1638,2020-06-22 16:11:55+00:00,16.198611111111113,"NEW YORK: Tomorrow is Election Day!

It’s time to VOTE to continue our fight for social, economic, and racial justice.

Make your plan for voting tomorrow.

Find your voting location here: https://t.co/lt9pjNp3hY https://t.co/nm8MlGeYPX"
1639,2020-06-22 11:56:11+00:00,11.936388888888889,"🚨NYC: If you plan on voting absentee, make sure you mail your ballot TODAY so it will be postmarked in time to count.

If you mail your ballot tomorrow, it may get postmarked too late and your vote may not count!

🗳(You can still vote in person instead if you got an absentee.)"
1640,2020-06-21 22:36:36+00:00,22.610000000000003,@kendallybrown Hey! I apologize for the harm and thank you for stepping up to point it out. Taking it down &amp; always open to engaging further. 💜
1641,2020-06-21 20:18:51+00:00,20.31416666666667,RT @ClintSmithIII: Father's Day is a good day to remind people that all phone calls and video calls for incarcerated people should be free…
1642,2020-06-21 19:19:00+00:00,19.316666666666666,"To all dads + father figures,
past, present, and future -

Your love, attention, and care moves mountains and changes the world. Thank you!

My papá believed in me, coached me, and challenged me. I wouldn’t be me without having had the gift of his love.

Happy Father’s Day 💙 https://t.co/D5zw1WmKr2"
1643,2020-06-21 01:59:50+00:00,1.9972222222222222,"Ah yes - in fact, I’m so uncharismatic and untalented that the President of the United States has dedicated time at multiple rallies over two years to talk about me, a first term member of Congress 💁🏽‍♀️ https://t.co/OncmV2u7Nw"
1644,2020-06-21 00:32:19+00:00,0.5386111111111112,"KPop allies, we see and appreciate your contributions in the fight for justice too 😌"
1645,2020-06-21 00:27:00+00:00,0.45,"Actually you just got ROCKED by teens on TikTok who flooded the Trump campaign w/ fake ticket reservations &amp; tricked you into believing a million people wanted your white supremacist open mic enough to pack an arena during COVID

Shout out to Zoomers. Y’all make me so proud. ☺️ https://t.co/jGrp5bSZ9T"
1646,2020-06-20 22:05:25+00:00,22.090277777777775,"What a day.

As I walked to my early voting site, I realized it was the Sonia Sotomayor Community Center.

When she was named 1st Latina to the SCOTUS, a Bronx Boricua, it made a younger me feel like there was a place for me in the world.

Today I cast my ballot under her name 😭 https://t.co/DiyhiXWYf5"
1647,2020-06-20 04:14:45+00:00,4.245833333333334,"RT @AriBerman: Kentucky cutting number of polling places for Tuesday’s primary from 3700 to 200

There will be one polling place for 616,00…"
1648,2020-06-20 04:04:37+00:00,4.076944444444444,"RT @NewYorkStateAG: I'm concerned about the sudden replacement of the United States Attorney in New York’s Southern District.

The new Unit…"
1649,2020-06-20 04:01:55+00:00,4.031944444444444,RT @SDNYnews: https://t.co/hFNvQs5orV
1650,2020-06-20 02:56:26+00:00,2.9405555555555556,@jnzqns So many thanks to you and your family! Postcarding is one of my favorite modes of indoor field organizing 💌
1651,2020-06-20 02:53:41+00:00,2.894722222222222,@victoriascress 💃🏽💃🏽💃🏽
1652,2020-06-20 02:47:44+00:00,2.7955555555555556,"Donation link here 💸

The average donation to my campaign is about 24 bucks. Everyday people have made my candidacy a possibility since day one.

That’s who I work for, now &amp; always - these billionaires are just mad they’ve found something they can’t buy.
https://t.co/OwNfE7AG70"
1653,2020-06-20 02:37:39+00:00,2.6275,"Wall St CEOs &amp; lobbyists are FLOODING my district w/ millions of dollars right before Tuesday’s election.

It’s a bit flattering, actually: they wouldn’t target me if I wasn’t effective 😌

Join us for the home stretch. Vol, call, or donate this weekend: https://t.co/BZgTRnGWK1 https://t.co/M37T8b5aRW"
1654,2020-06-19 17:35:52+00:00,17.597777777777775,"RT @NMAAHC: #OTD in 1865, enslaved African Americans were notified of their freedom by Union troops in Galveston Bay, TX—two years after th…"
1655,2020-06-19 14:58:42+00:00,14.978333333333333,"RT @jbouie: “Emancipation wasn’t a gift bestowed on the slaves; it was something they took for themselves, the culmination of their long st…"
1656,2020-06-19 13:13:39+00:00,13.227500000000001,"Ever notice that when we talk about having a healthcare system where people don’t pay at the point of service, it’s “Free stuff is irresponsible &amp; wrong!” but when it comes to raining military equip on undertrained police across the country it’s “Hey don’t worry it’s free stuff” https://t.co/RDlEqCMHuL"
1657,2020-06-19 13:00:04+00:00,13.001111111111111,"Happy #Juneteenth!

To celebrate, let’s pass legislation that makes Juneteenth a national holiday and enact H.R. 40, Rep @JacksonLeeTX18’s Commission on Reparations.

How are you honoring today?"
1658,2020-06-19 12:31:35+00:00,12.52638888888889,"RT @Telemundo: .@AOC: “Nuestra voz es nuestro voto y si no usamos ese derecho vamos a tener problemas”.

Vía @TelemundoNews 👉🏻 https://t.co…"
1659,2020-06-18 23:47:50+00:00,23.797222222222224,"RT @KumarRaoNYC: A better world is possible. 

Powerful and beautifully-filmed closing ad from @AOC in advance of Tuesday primary election.…"
1660,2020-06-18 22:56:45+00:00,22.945833333333333,@JuanSaaa @TelemundoNews En esta casa hablamos legislative Spanglish 😂
1661,2020-06-18 21:46:13+00:00,21.77027777777778,"RT @SDNYC: ”It’s time to bring the movement to the voting booth” ✊🏽

Vote for @AOC on June 23rd."
1662,2020-06-18 21:15:50+00:00,21.26388888888889,RT @OfficialJLD: Powerful ad!
1663,2020-06-18 21:15:47+00:00,21.263055555555557,@OfficialJLD Thanks! 💕
1664,2020-06-18 21:09:50+00:00,21.163888888888888,RT @aaronlarnavarro: super 8 film grain in the new AOC ad
1665,2020-06-18 21:08:23+00:00,21.139722222222222,RT @thor_benson: This is a great ad.
1666,2020-06-18 21:06:25+00:00,21.106944444444444,@amandalitman Thanks!
1667,2020-06-18 18:28:28+00:00,18.474444444444444,"Get help finding your polling location, sign up to volunteer, donate, and more at https://t.co/IVIqtODm9q"
1668,2020-06-18 18:27:03+00:00,18.450833333333332,"A better world is not only possible, it is within our reach.

From mutual aid in our communities to solidarity in the streets, the people of New York have already started to reshape our future.

It’s time to bring the movement to the voting booth.

VOTE this Tuesday, June 23rd. https://t.co/boXm0U4sZ4"
1669,2020-06-18 17:31:44+00:00,17.528888888888886,"RT @JFK_America: Is Wall Street scared of @AOC? Seems so. Chiefs at Goldman Sachs, Blackstone and many other top financiers spent millions…"
1670,2020-06-18 17:19:59+00:00,17.333055555555557,Ugh sorry y’all the link always autocorrects wrong - here’s the right one: https://t.co/dVZwJAic7m
1671,2020-06-18 17:13:03+00:00,17.217499999999998,"Wall Street is pouring *millions of dollars* to unseat me in this Tuesday’s election.

That’s what happens when you put people before profit. But take it from me: we CANNOT take this seat for granted.

NY14: VOTE TODAY or this Tuesday. Bring friends + fam: https://t.co/K2L7BQ8pIy https://t.co/yaYFTqoDNv"
1672,2020-06-18 14:26:48+00:00,14.446666666666667,Good morning y échate pa’ lante because HOME IS HERE! 🌞 https://t.co/K8YvJGvUHI
1673,2020-06-17 21:37:57+00:00,21.6325,RT @ajplus: BREAKING: The police officer who shot and killed #RayshardBrooks has been charged with felony murder and aggravated assault. He…
1674,2020-06-17 20:41:25+00:00,20.690277777777776,"RT @RevDrBarber: Every attack on the poor must embolden our agitation. Lack of healthcare, lack of living wages, black men &amp; women getting…"
1675,2020-06-17 19:24:18+00:00,19.404999999999998,RT @AyannaPressley: We need leaders like @JamaalBowmanNY in Congress now more than ever. Jamaal will be relentless in his commitment to uni…
1676,2020-06-17 19:09:46+00:00,19.162777777777777,RT @RashidaTlaib: Facial recognition technology is racist.
1677,2020-06-17 19:06:13+00:00,19.103611111111114,"NY: We are 6 DAYS AWAY from the June 23rd primary election!

Next Tuesday is Election Day, but you can cast your ballot IN PERSON *today* via early voting.

Check this energy. We need it. Send @JamaalBowmanNY to Congresss this year.

🗳 You can vote TODAY: https://t.co/dVZwJAic7m https://t.co/9Lyu8LPkOZ"
1678,2020-06-17 18:57:45+00:00,18.9625,"Pro tip: For the politicians denouncing Black leaders demanding shifts in budget priorities away from overpolicing &amp; into community services, check their campaign receipts.

If these politicians take money from police associations, how can they be objective about police budgets?"
1679,2020-06-16 15:21:23+00:00,15.356388888888889,RT @ava: This is a white woman talking honestly about her experiences and its one of the best threads on the criminalization of Black peopl…
1680,2020-06-16 01:57:57+00:00,1.9658333333333333,"RT @350: Now is the time for ALL climate activists to show up for Black Lives. 350 organizer Dominique Thomas breaks down how and why:
#Bla…"
1681,2020-06-16 00:18:30+00:00,0.30833333333333335,"RT @BerniceKing: We must question ours.

As my father said, “A nation that continues year after year to spend more money on military defens…"
1682,2020-06-16 00:02:25+00:00,0.04027777777777777,"Teachers are paying out of pocket for school supplies, yet police are given extra tanks.

Budgets convey priorities.
We should question ours."
1683,2020-06-15 19:44:56+00:00,19.74888888888889,"RT @JamaalBowmanNY: I am honored to have earned @katieporteroc's support and endorsement. 

A member of the insurgent class of 2018, Rep. P…"
1684,2020-06-15 19:26:11+00:00,19.43638888888889,"RT @EFEnoticias: ENTREVISTA | La congresista demócrata de EEUU Alexandria Ocasio-Cortez @AOC hace un llamamiento al voto latino ante el ""pe…"
1685,2020-06-14 21:55:05+00:00,21.918055555555558,RT @mayawiley: #nycprotests have not slowed any more than they have around the country because initial legislative reforms are frst steps..…
1686,2020-06-14 18:38:53+00:00,18.648055555555555,"RT @RaquelWillis_: TODAY. WE WILL RALLY b/c jail officials laughed at a trans AfroLatina minutes before she died, 2 Black trans women we're…"
1687,2020-06-14 17:26:37+00:00,17.44361111111111,"Oh look, someone took a photo of what my life is like debating Republicans in committee each week https://t.co/OMxPpbo1i1"
1688,2020-06-13 18:06:25+00:00,18.106944444444444,RT @JohnBoyega: This is a good time to question absolutely everything. You want to go back to the same old system?
1689,2020-06-12 23:26:45+00:00,23.445833333333333,"Oh look, a looting in progress ⬇️ https://t.co/I0vPDVRGCc"
1690,2020-06-12 22:01:20+00:00,22.022222222222222,"This is the issue w/ many “reforms”: yes, you can pass certain laws, but the problem is police *breaking the law.*

Murder is already illegal, but the officers who killed Breonna Taylor STILL haven’t been arrested.

Taking on that abuse of power often takes major political risk. https://t.co/zITJneHmfa"
1691,2020-06-12 01:03:14+00:00,1.0538888888888889,"RT @ashley_quan: .@AOC's answer to ""what does defund the police look like?"" was ""a suburb"" and that is totally gonna be my answer from now…"
1692,2020-06-11 17:56:11+00:00,17.93638888888889,"RT @AsteadWesley: Notice the raceless one side, ""his base"" is juxtaposed to a ""multiracial country."" An unnecessary contortion meant to avo…"
1693,2020-06-11 16:57:04+00:00,16.95111111111111,People really need to ask themselves why their communities chose to erect statues to slaveholders instead of abolitionists.
1694,2020-06-11 01:20:10+00:00,1.336111111111111,"RT @DanRather: So. Let's set the stage... 
President Trump has chosen as the venue for his first rally in months, Tulsa, Oklahoma, site of…"
1695,2020-06-11 01:07:17+00:00,1.121388888888889,"@Deb4CongressNM You are the living testimony of their hard work, sacrifice, and faith in a better future.

Every day it’s an honor to serve alongside you as you break through injustice and make history, @Deb4CongressNM. 💜"
1696,2020-06-10 22:43:07+00:00,22.71861111111111,"Shout out to @IBM for halting dev on technology shown to harm society.

Facial recognition is a horrifying, inaccurate tool that fuels racial profiling + mass surveillance. It regularly falsely ID’s Black + Brown people as criminal.

It shouldn’t be anywhere near law enforcement. https://t.co/SOU670yRVc"
1697,2020-06-10 21:37:05+00:00,21.618055555555557,"It truly boggles my mind how anyone can see a $6 billion policing budget in ONE city alone - which is more than we spend on health, youth, housing, and homelessness services here *combined* - and say, “You know what will fix police brutality? More money” https://t.co/s0oldDJSZS"
1698,2020-06-10 20:12:05+00:00,20.20138888888889,RT @NydiaVelazquez: Today's police forces look more like armies equipped with weapons of war. A fed'l program from the 1990s sends surplus…
1699,2020-06-10 17:20:34+00:00,17.342777777777776,"Politics &amp; media is rife w people who got to where they are w/ help from big money + family connections, &amp; it deeply bothers some to experience others who have accomplished similar or big things without those advantages.

They know they don’t have the range, so they belittle it. https://t.co/8sG7Dsqepz"
1700,2020-06-10 16:24:38+00:00,16.410555555555554,"Tear gas is a chemical weapon banned in war.

It is a deep shame that US leaders chose to tear gas our own people last week. It should never, ever happen again.

This week I’m joining @RepMarkTakano &amp; @RepChuyGarcia to introduce a National Ban on Tear Gas:
https://t.co/95G7ugsA38"
1701,2020-06-10 15:29:21+00:00,15.489166666666666,@starship_kid @UncleSacky Bingo
1702,2020-06-10 15:22:23+00:00,15.373055555555556,"The irony of this period is that Black and Brown residents were blamed for burning their own community, when they were the ones who rebuilt it.

If you want to learn more about this piece of history, the documentary @decadeoffire is a great place to start.
https://t.co/raRw1asTfk"
1703,2020-06-10 15:12:26+00:00,15.20722222222222,"In case anyone wonders why we go so hard in Congress:

Bronx landlords used set their own buildings on fire w/ families inside for insurance payouts. I grew up w my dad telling me stories about friends he lost.

Social and economic justice isn’t a game to us. It’s life and death. https://t.co/xRhcGXa1st"
1704,2020-06-10 14:05:17+00:00,14.088055555555556,Wow. https://t.co/gOBgpepOHJ
1705,2020-06-10 13:56:09+00:00,13.935833333333333,"This young woman’s testimony about her father’s role in her life,&amp; how she’s marching for George Floyd’s daughter, moved me.

I felt this way about my dad,too. The father-daughter bond is a formative one for many.

Thank you @RuschellBoone for sharing the humanity of this moment. https://t.co/bgDAa6rmbO"
1706,2020-06-10 13:44:00+00:00,13.733333333333333,RT @abbydphillip: Absentee ballot mystery: Georgia says 96% of ballots that were requested were delivered. Voters and local officials repor…
